{
  "id": "2026-10-08-citation-metric-definition-investigation",
  "date": "2026-10-08",
  "type": "decision",
  "title": {
    "en": "Two citation metrics, side by side.",
    "pt": "Duas métricas de citação, lado a lado."
  },
  "tags": [
    "metrics",
    "analytics",
    "multi-agent",
    "llm-observability",
    "evaluation-design"
  ],
  "narrative": {
    "en": "Before implementing an analytics metric that says how well an AI agent uses the evidence it is given, I asked whether the obvious definition was the right one. Two candidates looked equivalent: the share of calls that produced a citation, or the share of delivered evidence that got cited. Three parallel sub-agents examined the contract, simulated 13 scenarios and evaluated how people would read each version. Following either metric alone led to the wrong action in several cases, so the recommendation was to show both side by side, with the gap between them as the signal.",
    "pt": "Antes de implementar uma métrica de analytics que diz o quanto um agente de IA aproveita a evidência que recebe, perguntei se a definição óbvia era a certa. Dois candidatos pareciam equivalentes: a fração de chamadas que geraram uma citação ou a fração da evidência entregue que foi citada. Três subagentes em paralelo examinaram o contrato, simularam 13 cenários e avaliaram como as pessoas leriam cada versão. Seguir qualquer uma das métricas isoladamente levava à ação errada em vários casos, então a recomendação foi mostrar as duas lado a lado, com a divergência entre elas como sinal."
  },
  "technical": {
    "en": "**Setup:** read-only investigation (no code or repo changes) split across three sub-agents: (1) contract and validity: numerators, denominators, eligibility, deduplication, observation limits; (2) synthetic scenario matrix with computed rates; (3) heuristic usability evaluation plus a user-test protocol.\n\n**Candidates:** A = calls with ≥1 directly attributed, cited evidence / eligible calls. B = delivered-and-cited evidence / delivered evidence, in three aggregations: per-call ratio, mean of per-call ratios (macro), and pooled ratio over all evidence (micro). These weight calls differently and are not one metric.\n\n**Findings:**\n- The current schema already supports A and all B variants; only the metric code is missing (the existing branch is an unconditional stub).\n- \"Delivered\" must be the consumer-asserted delivery link, never the refs recorded by the decorator.\n- In 3 of 13 scenarios a single metric drives the wrong action: A hides 90% of unused evidence (10 delivered, 1 cited); the macro variant inverts rankings and masks dead calls; the pooled variant penalizes top-k tools by arithmetic (ceiling ≈ 1/k), which could suggest disabling the retrieval that feeds everything.\n- B depends far more on attribution ergonomics than A, so A degrades more gracefully when attribution coverage is partial.\n\n**Rules kept:** citation ≠ quality or causality; missing attribution is reported as an interval, never silently zero; no automatic causal credit from a search to a later open; no \"last global event\" fallback.\n\n**Decision:** show both, named so the denominator is explicit, per tool and stage; the divergence (high A, low B) diagnoses result excess. Confidence: medium. Heuristic evaluation is labeled as such, and a 15-participant Latin-square protocol (8 tasks with answer keys, 3 trap tasks, pre-registered criteria) was delivered. No user validation was claimed.",
    "pt": "**Montagem:** investigação somente leitura (sem alterar código nem repositório), dividida em três subagentes: (1) contrato e validade: numeradores, denominadores, elegibilidade, deduplicação e limites de observação; (2) matriz de cenários sintéticos com taxas calculadas; (3) avaliação heurística de usabilidade mais protocolo de teste com usuários.\n\n**Candidatos:** A = chamadas com ≥1 evidência citada e diretamente atribuída / chamadas elegíveis. B = evidências entregues e citadas / evidências entregues, em três agregações: proporção por chamada, média das proporções por chamada (macro) e proporção agregada de todas as evidências (micro). Elas pesam as chamadas de formas diferentes e não são uma única métrica.\n\n**Achados:**\n- O schema atual já sustenta A e todas as variantes de B; falta só o código da métrica (o ramo existente é um stub incondicional).\n- \"Entregue\" deve ser o vínculo de entrega afirmado pelo consumidor, nunca os refs registrados pelo decorator.\n- Em 3 de 13 cenários, uma métrica isolada leva à ação errada: A esconde 90% da evidência não aproveitada (10 entregues, 1 citada); a variante macro inverte rankings e mascara chamadas mortas; a variante agregada pune ferramentas top-k por aritmética (teto ≈ 1/k), o que poderia sugerir desligar a busca que alimenta tudo.\n- B depende muito mais da ergonomia de atribuição do que A, então A degrada melhor quando a cobertura de atribuição é parcial.\n\n**Regras mantidas:** citação ≠ qualidade ou causalidade; atribuição ausente vira intervalo, nunca zero silencioso; sem crédito causal automático da busca para uma abertura posterior; sem fallback de \"último evento global\".\n\n**Decisão:** mostrar as duas, com nomes que deixam o denominador explícito, por ferramenta e etapa; a divergência (A alta, B baixa) diagnostica excesso de resultados. Confiança: média. A avaliação heurística está rotulada como tal, e foi entregue um protocolo de quadrado latino com 15 participantes (8 tarefas com gabarito, 3 armadilhas, critérios pré-registrados). Nenhuma validação com usuários foi alegada."
  },
  "outcome": {
    "en": "13 synthetic scenarios computed; 3 showed a single metric leading to the wrong action, which led to the recommendation to present both.",
    "pt": "13 cenários sintéticos calculados; 3 mostraram uma métrica isolada levando à ação errada, o que levou à recomendação de apresentar as duas."
  },
  "status": "published"
}
