{
  "id": "2026-10-16-voice-loop-prompt-submit-over-stop-hook",
  "date": "2026-10-16",
  "type": "decision",
  "title": {
    "en": "Talking to a coding agent by voice.",
    "pt": "Conversar por voz com um agente de código."
  },
  "tags": [
    "claude-code",
    "plugins",
    "voice",
    "hooks",
    "local-first"
  ],
  "narrative": {
    "en": "Wanted a hands-free voice conversation with a coding agent, like ChatGPT's voice mode: press talk, speak, the agent answers out loud. The first version kept the agent 'waiting' for the next sentence, which broke as soon as the session sat idle and needed an extra keypress. Instead of patching the waiting trick, the delivery mechanism was replaced: a small plugin inside each session now submits the transcribed speech as a normal prompt, so nothing has to stay blocked and no Enter is needed.",
    "pt": "A ideia era conversar por voz com um agente de código sem usar as mãos, como o modo de voz do ChatGPT: aperta falar, fala, e o agente responde em voz alta. A primeira versão mantinha o agente 'esperando' a próxima frase, o que quebrava quando a sessão ficava parada e ainda exigia um Enter. Em vez de remendar a espera, troquei o mecanismo de entrega: um plugin pequeno dentro de cada sessão envia a fala transcrita como um prompt normal, então nada fica bloqueado e não precisa de Enter."
  },
  "technical": {
    "en": "Local daemon: VAD closes utterances on silence, Parakeet transcribes on-device, macOS `say` speaks replies (mic paused while speaking to avoid self-hearing). v1 delivered speech through a blocking Stop hook (`decision: block` with the transcript as reason, up to 240s wait) plus PostToolUse for mid-work interjections. Failure: after the wait expired or the session idled, speech showed as 'listening' but never reached the agent. v2: a Claude Code hooks-module plugin (loaded via `CLAUDE_CODE_PLUGIN_DIRS`) polls the daemon `/pending` every 400ms and calls `$.prompt.submit` — the same path as a typed prompt, valid on an idle session. Stop hook wait set to 0. Target session = last one that replied; widget shows connected-session count. Trade-off: polling in every session and dependence on a plugin API vs. a hook-only approach that is stateless but time-boxed.",
    "pt": "Daemon local: VAD fecha a frase no silêncio, Parakeet transcreve no dispositivo, `say` do macOS fala a resposta (microfone pausado enquanto fala, pra não se ouvir). A v1 entregava a fala por um Stop hook bloqueante (`decision: block` com a transcrição como reason, espera de até 240s) mais PostToolUse para interrupções durante o trabalho. Falha: com a espera expirada ou a sessão parada, o botão aparecia como 'ouvindo' mas a fala nunca chegava ao agente. v2: um plugin de módulo de hooks do Claude Code (carregado via `CLAUDE_CODE_PLUGIN_DIRS`) consulta o `/pending` do daemon a cada 400ms e chama `$.prompt.submit`, o mesmo caminho de um prompt digitado, válido com a sessão parada. Espera do Stop hook vai a 0. Sessão alvo = a última que respondeu; o widget mostra quantas sessões estão conectadas. Trade-off: polling em toda sessão e dependência de uma API de plugin, contra a abordagem só com hooks, que é sem estado mas limitada por tempo."
  },
  "outcome": {
    "en": "Speech now reaches an idle session with no Enter and no 240s wait window.",
    "pt": "A fala agora chega a uma sessão parada sem Enter e sem a janela de espera de 240s."
  },
  "status": "published"
}
