{
  "id": "2026-10-08-batch-size-bytes-not-count-experiment",
  "date": "2026-10-08",
  "type": "decision",
  "title": {
    "en": "Cap the batch by bytes, not by records.",
    "pt": "Limitar o lote por bytes, não por registros."
  },
  "tags": [
    "surrealdb",
    "batching",
    "experiment-design",
    "reliability",
    "http"
  ],
  "narrative": {
    "en": "A bulk-ingestion routine sent records to the database in fixed-size batches, and the open question was how big a batch should be. Instead of guessing, I ran a controlled experiment against a real database server and found the real limit was set by payload bytes, not record count. A batch size that looks safe is only safe by accident of how large each record happens to be, so the recommendation was to cap batches by bytes.",
    "pt": "Uma rotina de ingestão em massa enviava registros ao banco em lotes de tamanho fixo, e a pergunta em aberto era qual deveria ser o tamanho do lote. Em vez de chutar, rodei um experimento controlado contra um servidor de banco real e descobri que o limite verdadeiro vem dos bytes do payload, não da contagem de registros. Um tamanho de lote que parece seguro só é seguro por acidente do tamanho de cada registro, então a recomendação foi limitar os lotes por bytes."
  },
  "technical": {
    "en": "**Setup:** real SurrealDB 3.1.5 over `POST /sql`, statements generated by the production upsert builder, a 417-unit corpus (real passages plus synthetic short/medium/long ones) with precomputed 384-dim embeddings. Byte caps were decided and recorded before the runs. Each strategy ran with a warm-up plus 5 repetitions in rotated order, a fresh database per run, and separate phases (initial load, re-ingest, rebuild). A local proxy with a 256 KiB limit simulated a clean 413.\n\n**Findings:**\n- The body limit is exactly 1 MiB, found by binary search with padding payloads. With ~10 KB statements dominated by the embedding, the ceiling falls between 50 and 100 statements per batch. Fixed batches of 100 and 200 failed 5/5, and the existing default of 200 overshoots by a wide margin.\n- Above the limit, rejection degrades from a readable 413 (1 MiB+1B: 6/6 clean) to a connection closed mid-upload (3 MiB: 6/6 `BrokenPipeError`). So an adaptive 'split only on 413' strategy failed 5/5 against the direct server. Behind a proxy that returns a clean 413 it works, but resends 1,275 statements and transfers 4x the payload (16.7 MB vs 4.1 MB).\n- Partial state is real: a 413 after 20 successful batches left the earlier 400 rows persisted, with no rollback.\n- Idempotency held everywhere: identical content hashes across initial load, re-ingest and rebuild for every strategy.\n\n**Decision:** a byte-bounded batch with headroom (768 KiB, 75% of the limit) was fastest (0.70s, 601 stmts/s, 6 requests), had no 413s by construction, and was the only strategy that failed cleanly when a single statement exceeds the cap (it refuses before sending). A fixed batch of 20-50 is an acceptable simple option, but its safety is a coincidence of statement size. Caveats stated in the report: small corpus, localhost, concurrency 1, default server limit, so the numbers don't extrapolate, only the shape does.",
    "pt": "**Setup:** SurrealDB 3.1.5 real via `POST /sql`, statements gerados pelo construtor de upsert de produção, corpus de 417 unidades (passagens reais mais sintéticas curtas/médias/longas) com embeddings de 384 dims pré-calculados. Os tetos em bytes foram decididos e registrados antes das rodadas. Cada estratégia rodou com aquecimento mais 5 repetições em ordem rotacionada, banco novo por run e fases separadas (carga inicial, reingestão, rebuild). Um proxy local com limite de 256 KiB simulou um 413 limpo.\n\n**Achados:**\n- O limite de corpo é exatamente 1 MiB, encontrado por busca binária com payloads de padding. Com statements de ~10 KB dominados pelo embedding, o teto cai entre 50 e 100 statements por lote. Lotes fixos de 100 e 200 falharam 5/5, e o default atual de 200 estoura com folga.\n- Acima do limite, a rejeição degrada de um 413 legível (1 MiB+1B: 6/6 limpo) para conexão fechada no meio do envio (3 MiB: 6/6 `BrokenPipeError`). Por isso a estratégia adaptativa 'subdivide só com 413' falhou 5/5 contra o servidor direto. Atrás de um proxy que devolve 413 limpo ela funciona, mas reenvia 1.275 statements e transfere 4x o payload (16,7 MB contra 4,1 MB).\n- O estado parcial é real: um 413 após 20 lotes bem-sucedidos deixou as 400 linhas anteriores persistidas, sem rollback.\n- A idempotência valeu em tudo: hash de conteúdo idêntico entre carga inicial, reingestão e rebuild, em todas as estratégias.\n\n**Decisão:** lote limitado por bytes com margem (768 KiB, 75% do limite) foi o mais rápido (0,70s, 601 stmts/s, 6 requests), não teve 413 por construção e foi o único que falha de forma limpa quando um statement sozinho excede o teto (recusa antes de enviar). Lote fixo de 20-50 é uma opção simples aceitável, mas sua segurança é coincidência do tamanho do statement. Limitações declaradas no relatório: corpus pequeno, localhost, concorrência 1, limite default do servidor, então os números não extrapolam, só a forma."
  },
  "outcome": {
    "en": "Fixed batches of 100+ failed 5/5 against the real server; the byte-bounded batch ran at 601 stmts/s with zero 413s.",
    "pt": "Lotes fixos de 100+ falharam 5/5 contra o servidor real; o lote limitado por bytes rodou a 601 stmts/s sem nenhum 413."
  },
  "status": "published"
}
