{
  "id": "2026-10-08-typed-reference-format-controlled-experiment",
  "date": "2026-10-08",
  "type": "decision",
  "tags": [
    "llm-agents",
    "experiment-design",
    "api-design",
    "mcp",
    "evals"
  ],
  "narrative": {
    "en": "A team debate over how tools should reference content (a structured object vs. a plain \"type:key\" string) was settled with a controlled experiment instead of taste. Two sub-agents built the same consumer in isolation, one per format, against a shared contract and adversarial fixtures, and a third audited the equivalence. Both formats turned out equally correct, and the experiment surfaced real bugs in the library underneath, which was the more useful result.",
    "pt": "Um debate sobre como as tools devem referenciar conteúdo (objeto estruturado ou string simples \"tipo:chave\") foi resolvido com um experimento controlado, não com gosto. Dois subagentes construíram o mesmo consumidor isoladamente, um por formato, sobre um contrato comum e fixtures adversariais, e um terceiro auditou a equivalência. Os dois formatos se mostraram igualmente corretos, e o experimento expôs bugs reais na biblioteca de base, que acabou sendo o resultado mais útil."
  },
  "technical": {
    "en": "**Design:** coordinator fixed fixtures, a functional contract and common criteria first; implementers A (JSON object) and B (string) worked in separate directories without reading each other's code; an auditor ran adversarial cases. Both pinned to the same library revision (not the local checkout, not an open PR). Fixtures made the stable key, typed ref and graph record ID deliberately different, with hostile keys (`:`/`::`, Unicode, spaces, record-ID lookalikes, key equal to the type name, same key in two types, composite key).\n\n**Deterministic layer:** 29 and 30 tests passed respectively, covering round-trip search→open→navigate→cite, malformed/unknown/incompatible refs, source removed after search, content change with stable identity, and a closed error vocabulary so none of them collapses into \"no information\".\n\n**Agent layer:** 7 tasks × 2 scenarios, fresh `claude -p` sessions, same model, alternating order, stream-json transcripts. Round 1: 6/7 vs 7/7 round-trips, zero malformed or altered refs in 14 runs, 100% valid citations. The single failure was giving up after empty searches (BM25 AND semantics vs. Portuguese queries), not the format. Replications with a second order and a weaker model were still pending when the session ended, so the report marks them as such.\n\n**Findings owned by the library, not the format:** the evidence link `unit` was inferred from the key by regex (a key shaped like a record ID produced a pointer to the wrong record); `cite` and `validate_claims` disagreed on whether a candidate is citeable; accepted ref shapes were inconsistent across three entry points.\n\n**Recommendation:** no experimental basis to prefer either; decide on what the experiment doesn't measure (the library already speaks `type:key`; the object allows closed schemas), and fix the inference bug regardless.",
    "pt": "**Desenho:** o coordenador fixou primeiro fixtures, contrato funcional e critérios comuns; os implementadores A (objeto JSON) e B (string) trabalharam em diretórios separados sem ler o código um do outro; um auditor rodou casos adversariais. Ambos fixados na mesma revisão da biblioteca (não o checkout local, não uma PR aberta). As fixtures tornaram chave estável, referência tipada e record ID do grafo deliberadamente diferentes, com chaves hostis (`:`/`::`, Unicode, espaços, aparência de record ID, chave igual ao nome do tipo, mesma chave em dois tipos, chave composta).\n\n**Camada determinística:** 29 e 30 testes passaram, cobrindo round-trip busca→abertura→navegação→citação, refs malformadas/desconhecidas/incompatíveis, fonte removida após a busca, mudança de conteúdo com identidade estável e um vocabulário fechado de erros, para que nenhum vire \"não há informação\".\n\n**Camada com agente:** 7 tarefas × 2 cenários, sessões novas de `claude -p`, mesmo modelo, ordem alternada, transcripts stream-json. Rodada 1: 6/7 vs 7/7 round-trips, zero refs malformadas ou alteradas em 14 runs, 100% de citações válidas. A única falha foi desistir após buscas vazias (BM25 com AND vs. perguntas em português), não o formato. As replicações com ordem invertida e modelo mais fraco ainda estavam pendentes ao fim da sessão, e o relatório as marca como tal.\n\n**Achados da biblioteca, não do formato:** o `unit` do link de evidência era deduzido da chave por regex (chave com cara de record ID gerava ponteiro para o registro errado); `cite` e `validate_claims` divergiam sobre candidato ser citável; formas de ref aceitas eram inconsistentes entre três pontos de entrada.\n\n**Recomendação:** sem base experimental para preferir um; decidir pelo que o experimento não mede (a biblioteca já fala `tipo:chave`; o objeto permite schema fechado) e corrigir a inferência de qualquer forma."
  },
  "outcome": {
    "en": "Both formats passed all deterministic cases (29/29 and 30/30 + 1 strict xfail) with 0 malformed refs in 14 agent runs; 3 library defects found and reproduced.",
    "pt": "Os dois formatos passaram todos os casos determinísticos (29/29 e 30/30 + 1 xfail estrito) com 0 refs malformadas em 14 runs de agente; 3 defeitos da biblioteca encontrados e reproduzidos."
  },
  "status": "published"
}
