{
  "id": "2026-07-14-survey-insights-architecture",
  "date": "2026-07-14",
  "type": "decision",
  "title": {
    "en": "Measure before debating architecture.",
    "pt": "Medir antes de debater arquitetura."
  },
  "tags": [
    "architecture",
    "pydantic-ai",
    "llm-guardrails",
    "survey-analysis",
    "api-design"
  ],
  "narrative": {
    "en": "Designing an API that turns survey data into business insights forced a core question: how do you make AI-generated findings trustworthy enough to act on? Instead of debating in the abstract, we measured first — then decided. The answer landed on two independent verification strategies that keep the AI accountable to the source data at every step, without adding embedding infrastructure or discarding the runs that fail.",
    "pt": "Projetar uma API que transforma dados de pesquisa survey em insights de negócio trouxe uma questão central: como tornar achados gerados por IA confiáveis o suficiente para agir? Em vez de debater no abstrato, medimos primeiro — e só então decidimos. A resposta combinou duas estratégias de verificação independentes que mantêm a IA accountable aos dados originais em cada etapa, sem adicionar infraestrutura de embedding nem descartar as runs que falham."
  },
  "technical": {
    "en": "Architecture session for an async FastAPI service (Python / Pydantic AI / SurrealDB) that processes survey data into structured, auditable insights — replacing a legacy `claude -p` shell pipeline.\n\n**Measure before decide:** Before committing to a retrieval/selection pipeline, wrote a scratch script querying the live SurrealDB instance to measure the actual persisted fact space. Result: ~12–14 k tokens (~6% of context window). No pipeline was justified until that symptom appeared in production — a concrete number closed a debate that would otherwise have been speculative.\n\n**Hybrid deterministic/LLM regime:** Split the insight core into two invariant regimes:\n- Closed questions (Likert, NPS, multiple-choice): pure Python, fully deterministic, golden-testable — LLM never touches this path.\n- Open-ended / qualitative: LLM identifies themes and frequency patterns; a deterministic quote-grounding check (verbatim substring match against the source CSV) validates every claim before persistence. Hallucination caught without embeddings — zero cost, fully auditable. The invariant: every qualitative fact must cite a traceable source fragment.\n\n**Guardrail failure as eval signal:** Pydantic AI output validator retries once on failure; persistent failures are stored with a `guardrail_failed` flag rather than discarded. Rationale: in early production runs, failure rate is the most useful quality signal — silently discarding failed outputs hides exactly what you need to learn.\n\n**Fact space recomputed per run:** Each run rebuilds its own fact space from source specs and persists it independently. Trade-off: redundant computation vs. full reproducibility — any run can be re-audited in isolation regardless of future schema or data changes.",
    "pt": "Sessão de design arquitetural para um serviço FastAPI async (Python / Pydantic AI / SurrealDB) que processa dados de pesquisa survey em insights estruturados e auditáveis — substituindo um pipeline legado baseado em `claude -p` no shell.\n\n**Medir antes de decidir:** Antes de comprometer com um pipeline de retrieval/seleção, escrevemos um script para consultar o SurrealDB local e medir o fact space persistido. Resultado: ~12–14 k tokens (~6% da janela de contexto). Nenhum pipeline se justificava até esse sintoma aparecer em produção — um número concreto fechou um debate que seria puramente especulativo.\n\n**Regime híbrido determinístico/LLM:** O núcleo de insights foi dividido em dois regimes com invariantes distintos:\n- Questões fechadas (Likert, NPS, múltipla escolha): Python puro, completamente determinístico, testável com golden files — LLM nunca toca esse caminho.\n- Questões abertas/qualitativas: LLM identifica temas e padrões de frequência; um guardrail de quote-grounding (substring match verbatim contra o CSV fonte) valida cada afirmação antes da persistência. Alucinação capturada sem embeddings — custo zero, 100% auditável. O invariante: todo fato qualitativo precisa citar um fragmento rastreável da fonte.\n\n**Falha de guardrail como sinal de avaliação:** O output validator do Pydantic AI faz 1 retry em falha; falhas persistentes são gravadas com flag `guardrail_failed` em vez de descartadas. Justificativa: nas primeiras runs em produção, a taxa de falha é o sinal de qualidade mais valioso — descartar silenciosamente os outputs que falham esconde exatamente o que se precisa aprender.\n\n**Fact space recomputado por run:** Cada run reconstrói seu próprio fact space a partir dos specs da fonte e o persiste de forma independente. Trade-off: computação redundante vs. reprodutibilidade total — qualquer run pode ser reauditada em isolamento, independente de mudanças futuras no schema ou nos dados."
  },
  "status": "published"
}
