{
  "id": "2026-10-15-ppi-variance-overlapping-labels-covariance",
  "date": "2026-10-15",
  "type": "problem-solved",
  "title": {
    "en": "The uncertainty was understated.",
    "pt": "A incerteza estava subestimada."
  },
  "tags": [
    "statistics",
    "evals",
    "prediction-powered-inference",
    "code-review",
    "python"
  ],
  "narrative": {
    "en": "An eval estimates how often an AI system is right by combining a small set of human-labeled cases with a large set scored automatically. A code reviewer built a case where the reported uncertainty was badly wrong. The cause: the labeled cases were a subset of the scored ones, so the two averages moved together, and the formula treated them as independent. Adding the missing correlation term fixed the estimate, and a review-driven test now guards it.",
    "pt": "Um eval estima com que frequência um sistema de IA acerta combinando um conjunto pequeno de casos rotulados por humanos com um conjunto grande pontuado automaticamente. Um revisor de código montou um caso em que a incerteza reportada estava muito errada. A causa: os casos rotulados eram um subconjunto dos pontuados, então as duas médias andavam juntas, e a fórmula as tratava como independentes. Incluir o termo de correlação que faltava corrigiu a estimativa, e agora há um teste que protege o caso."
  },
  "technical": {
    "en": "Prediction-powered inference (PPI) estimator: the variance was computed as `var(f)/N + var(r)/n`, which assumes the labeled sample and the scored sample are independent. In this design the labeled cases are a subset of the scored ones, so both means share the same `f` values and covary. Corrected variance: `var(f)/N + var(r)/n + 2·cov(f_labeled, r)/N`. Reviewer's adversarial case (all cases labeled, y = 1 − f) now yields exactly 1/12 instead of 5/12; three edge cases are pinned in tests. Earlier tests stayed valid because their labeled `f` values were constant (zero covariance). Same review round also reclassified timeout/interrupt/sink-failure events as *ambiguous* loss (a cancelled task does not undo a committed write), bounding the call count to an interval and returning a PARTIAL answer; only build-failed and write-refused prove loss. Trade-off: wider, honest intervals over tighter but overconfident ones.",
    "pt": "Estimador de inferência potencializada por predição (PPI): a variância era calculada como `var(f)/N + var(r)/n`, o que assume amostra rotulada e amostra pontuada independentes. Neste desenho os casos rotulados são subconjunto dos pontuados, então as duas médias compartilham os mesmos valores de `f` e covariam. Variância corrigida: `var(f)/N + var(r)/n + 2·cov(f_rotulado, r)/N`. O caso adversarial do revisor (todos rotulados, y = 1 − f) agora dá exatamente 1/12 em vez de 5/12; três casos-limite ficaram fixados em teste. Os testes antigos continuaram válidos porque neles os `f` rotulados eram constantes (covariância zero). Na mesma rodada de review, eventos de timeout/interrupção/falha de sink passaram a contar como perda *ambígua* (cancelar a task não desfaz um write já confirmado), limitando o número de chamadas a um intervalo e devolvendo resposta PARTIAL; só build-failed e write-refused provam perda. Trade-off: intervalos mais largos e honestos em vez de mais estreitos e excessivamente confiantes."
  },
  "outcome": {
    "en": "Variance on the reviewer's adversarial case went from 5/12 (wrong) to exactly 1/12; full suite 662 passed, 1 xfail.",
    "pt": "A variância no caso adversarial do revisor passou de 5/12 (errado) para exatamente 1/12; suíte completa com 662 passando e 1 xfail."
  },
  "status": "published"
}
