{
  "id": "2026-07-11-scroll-driven-animations",
  "date": "2026-07-11",
  "type": "learning",
  "title": {
    "en": "A timeline that draws itself without JavaScript.",
    "pt": "Uma linha do tempo que se desenha sem JavaScript."
  },
  "tags": [
    "css",
    "scroll-driven-animations",
    "progressive-enhancement"
  ],
  "narrative": {
    "en": "First real-world use of CSS scroll-driven animations: this feed's timeline draws itself as you scroll, with zero JavaScript. The motion concept for the site — pulse, trace, breath — had to communicate 'alive' without a single animation library.",
    "pt": "Primeiro uso em produção de scroll-driven animations do CSS: a linha do tempo deste feed se desenha conforme você rola, com zero JavaScript. O conceito de movimento do site — pulso, traço, respiração — precisava comunicar 'vivo' sem nenhuma biblioteca de animação."
  },
  "technical": {
    "en": "`animation-timeline: view()` maps an animation's progress to an element's position in the viewport — the timeline border scales from 0 to full height as each entry crosses it. Wrapped in `@supports` so unsupported browsers just see the static border, and disabled under `prefers-reduced-motion`. The rest of the motion system is a ~30-line inline IntersectionObserver (staggered reveal) gated behind an `html.js` class, so a JavaScript failure can never leave content hidden.",
    "pt": "`animation-timeline: view()` mapeia o progresso de uma animação à posição do elemento no viewport — a borda da linha do tempo escala de 0 à altura total conforme cada entrada a cruza. Embrulhado em `@supports` para que navegadores sem suporte vejam só a borda estática, e desligado sob `prefers-reduced-motion`. O resto do sistema de movimento é um IntersectionObserver inline de ~30 linhas (reveal escalonado) atrás de uma classe `html.js`, então uma falha de JavaScript nunca deixa conteúdo escondido."
  },
  "outcome": {
    "en": "Feed timeline draws on scroll in ~20 lines of CSS; zero JS, zero libraries.",
    "pt": "A linha do feed se desenha no scroll em ~20 linhas de CSS; zero JS, zero bibliotecas."
  },
  "project": "living-portfolio",
  "status": "published"
}
